Architecture	Biotechnology	Civil Engg	Chemical Engg	"CSE EEE ECE"	Engg Phy	Material Science	Mathematics	"Mech Engg, Prod Engg"	Miscellaneous topics																			
Design Theory	Nanobiotechnology	Structural Engineering	Polymer Science	Digital VLSI	Quantum computation and information	Energy Production and Storage	Algebra	Clean energy 	Climate change and sustainability 																			
Building Science/Technology	Tissue engineering	Geotechnical engineering 	Molecular Simulations	Analog and Mixed Signal	Photonics, optoelectronics and device physics	Electronics & Photonics	Calculus and analysis	Supply Chain Management 	Startups																			
Construction Science/Technology	Stem cell therapy	Transportation Engineering 	Biophysics	Signals and Systems	Nanoscale science and technology	Bioinspired Materials and Systems	Geometry and topology	Numerical Methods 																				
Critical History	Genetically modified food	Construction management 	Biochemistry	Communication	Ultrafast physics	Green Technologies	Combinatorics	Data Science & Analytics																				
Construction Methods/Materials	Gerontology	Enviromental engineering 	Reaction Engineering	Digital Signal Processing	Microscopy and advanced imaging		Logic	Operations Research & Optimization 																				
Urban Planning/Design	Pharmacology	Coastal/Ocean Engineering 	Catalysis	Biomedical Imaging, Sensing and Genomic Signal Processing	Biomaterials and biophysics		Number theory	Marine engineering and merchant shipping																				
Historic Conservation/Preservation	Bioethics	Urban Planning	Process Control	Device Science and Nanotechnology	Liquids and soft matter		Dynamical systems and differential equations	Petroleum/ Oil & Gas/ Petrochemical/ Mining engineering 																				
Product Design	Enzymology	Water Resources Engineering	Machine Learning for Process Control	Energy and Power, Power Electronics	Materials for energy		Mathematical physics	Manufacturing/Production Engineering 																				
Industrial Design		Earthquake engineering 	Machine Learning for Polymer Science	Electromagnetics and Microwaves	Geophysics		Theory of computation	Operations Engineering & Management 																				
		Materials/Pavements 	Machine Learning for Biophysics	Information Science and Systems	Computational physics and numerical methods		Information theory and signal processing	Quality & Reliability Engineering																				
		Tunnel Engineering 	Bioengineering	Artificial Intelligence, Machine Learning, Data Science	Interdisciplinary physics and engineering		Probability and statistics	Industrial Engineering 																				
		geographic information systems (GIS)	Fluid Mechanics	Power Generation and Transmission			Game theory	Machine design 																				
		Aerospace Structures/Aerodynamics 	Environmental Science	Autonomous Driving			Operations research	Transportation and Mobility 																				
		Environmental Science	Surface Science	Cloud Computing, Big data, Distributed systems				Therrmal Engineering 																				
		Systems Engineering 	Materials Science	Computer Architecture, Operating Systems				Fluid mechanics and machinery 																				
		Safety Engineering 	Systems Engineering	Embedded Systems				Mechatronics and robotics 																				
		Soil mechanics and Foundation Engineering 	Optimization	Cryptography				Behavioral Economics 																				
		Computational mechanics	Electronic, Magnetic and Photonic Materials	Computer networks, security				Business Analytics 																				
		Geology	Nanotechnology					Energy Management 																				
		Structural Dynamics 	Quantum Mechanics					Organization Development & Change Management 																				
		Hydraulics	Electrochemistry					Systems Simulation 																				
		Applied Statistics 	Statistical Mechanics																									
		Data Science/Analytics 	Membranes and Separations																									
																												